clean_comment,category
where did you pull out the figure 270 for nda think its gonna more like party seats won nda 220 cong 120 aap other 170 reasons case you are forgetting bjp hardly has any powerful allies now 270 being like way too optimistic cong tally 120 may seem low but guess thats their best case scenario anti incumbency strong against them look how they were wiped out from delhi and rajasthan that context guess 120 the best congress will aap again best case scenario although highly doubt this number myself but given the limelight they are right now its not totally impossible others 170 this where the action this has bsp tmc dmk aiadmk bjd cpi cpm jdu jds etc said most are congress friendly pseudo secular parties,1
sorry know this isn what you asked just venting frustration here aap has thrown everything off but they keep this nationalisation anti fdi reservation increased quotas referendums for everything hopefully they won get many votes watching ndtv now listening rabbi shergill singer aap talk about how growth bad that mnc are evil american corporations delhi gov freakin reversed the decision fdi that previous government took after years deliberation less than month this action alone will raise red flags the investment community there respect for continuity their actions will back wearing langotis and burning cow dung aap comes power wholeheartedly thank congress for supporting aap delhi because quite clear they are leftist radicals waiting cut off india from the rest the world expected good governance anti corruption yet see any major person tried let alone jail ,-1
vote for government rather than candidate the brightest candidate from your constituency can shit get unstable corrupt government bedeviled with policy paralysis 2014 there are only three choices for government congress allies upa bjp allies nda others aap bsp cpm cpi aidmk dmk jdu jds etc third front possibly supported congress ,-1
 going vote for modiji and hope you guys would too need infrastructure growth manufacturing and agriculture sectors and not populist schemes need leader who has vision for this nation ,0
tharoor case national importance with the mention the dead wife isi agent having affair with union minister but won probed she also gave indication wrong doing ipl and that she shall reveal more information about that and considering ipl nexus politicians and corporates again doubt the matter will move forward ,-1
can someone the media investigate who raga humping how tough know that even turns out kjo for that matter ,-1
 everytime she the twitter person writes were told who were the people who were telling her her father husband friends who the marriage wasn child marriage the legal sense what does the urged his wife pursue education while dumping his wife supposed show women empowerment ,1
 fakingnews saying that aap seasonal very clever their part ,1
chai with modi cough syrup with kejriwal poison with sonia ,0
 the end rapid fire round you can win gift hamper with autographed muffler from the man himself special edition topi turn poster which will taken back the next day and once lifetime chance night raid with somnath bharti ,1
 was totally convinced until read the source ,0
for moment thought this post from circlejerk,0
 but being closely followed “dharna party with ” that already happened couple weeks ago rail bhawan ,0
ahh that what aapeians are high ,1
cough cough bullshit cough ,0
namo ambani dukan aap said has true ,1
pick these namo made easy for ambani business gujarat with friendly terms offers perks namo sold gujarat ambanis bending rules writing off taxes giving them cheap land electricity etc both basically mean the same thing upto you pick choose your pill ,1
 what exactly our resident modi basher asking for here for modi come out and declare ambani guilty until proven innocent the first place why obligated take such great interest the basin andhra pradesh again and the second place isn that matter already court ,1
shh one wants hear the uncomfortable truth ,-1
 still our shining knight and you dont think would like see your proof and any relevant court convictions ,1
this the only time have back kejri over nano man kejri turning out legend now certain that the crazy guy incorruptible ,1
modi cannot win even gujarat without bjp cadre ,1
 isn the usp bjp now ,0
 modi says vote for india will vote for party which can provide stable government the center which has leader like modi someone who dreams big strong decisive and can make things happen helps build culture against nepotism and one hard work and success,1
namo party only condition call something other than that ,-1
this interesting guess most bjp skeptics might just have change heart ,1
that would the best way separate the hindu extremist clan from the real believers development among the current bjp clan wish namo would that would not only just vote for him actively campaign from him distances him from that rss driven bjp ,1
would depend the reason break ,0
 not modi backer but break away and form party without associating with any religion yes will ,0
hey coprophagus tards manual scavengers are calling from gujarat ,0
saala chutya modi please give vote kejri ,0
and exactly what relevance does this hold anything ,1
manual scavengers you even lift ,0
 want make this man yes yes ,0
then this view and shri hazzart kujliwals benevolence towards khap steps ahead edit vote for app party ,0
this was written mahatma gandhi how can this attributed modi edit not joking because was surprised when found this stuff the mahatma but then his writings about blacks are worse edit did not mean that the thing was written gandhi what meant was that this was gandhi philosophy for example even arguing for untouchables right walk through temple street gandhi would say that they might untouchable due karma but they have the right passage very perverse attitude and was criticized ambedkar lot modi wrong adopting the same line but this what happens when person idolized father nation and what not ,1
 modi spiritual potion woo karmayogis spiritual potion woo karmayogis modi and the art ‘disappearing’ untouchability ,0
should have directly linked the article here htm ,1
 screenshot case some one the bjp sheep herd decide edit editing wikipedia logged history ,0
will some well meaning modi supporter just come out and say this particular view modi wrong but that this shouldn the only determining factor judging candidate people have faulty views certain things rather than aggravating debate making unrelated points about some other party would more helpful modi supporter just says wrong much debate for nothing ,-1
this guy pure religious fundamentalist guy pakistan mistake was being islamist country and this man wants india hindu country religion and nationalism deadly cocktail ,1
aap slowly turning into congress day passes real issues against modi repeat same issues that congress has already tried only one agenda for election stop modi any how ,-1
 this was response the genocide bangladeshi hindus after babri masjid the recent attacks them why this sentence unacceptable ,0
link the speech ,0
let see 400 million people live poverty how about becoming self sufficient before supporting refugees lol the vote bank politics never ceases amuse ,1
there absolutely citation with this quote yet note how anti modi guys are using this make their case against modi while pro modi guys are coming with justification for the quote both sides believes the quote real ,1
well the end the day believe you are facing atrocities particular place you have the right leave now bangladesh see only hindus that are being persecuted while muslims are not hence rest case ,1
kick muslims out ,0
try better aaptards ,1
turn back now the comments this thread are absolutely shit ,-1
climate change could create million bangladeshi refugees 2030 and guess where they all headed ,0
muslims need eliminated ahead modi are with you ,0
 really wonder the logical dissonance this post modi may very well think this but point out one example such thinking leading the exploitation the valmikis gujarat under his administration long his policies aren affected such views which may add were put forward seven years ago there reason criticise his leadership here edit downvotes why ,1
even though not practicing christian christian born and indian citizen this frightens thought modi was different bjp leader pushing national unity and all sad ,-1
actually bangladeshi hindus should accommodated india for the very reason muslims are part this country much hindus when india was partitioned two nations were formed india and pakistan while india chose remain secular nation giving equal rights all least theory pakistan chose become islamic nation where hindus not have the same right muslims india has accommodate all muslims who wish part this country because founders our nations decided this people may grudge this decision but have accept and fulfill this promise pakistan the other hand doesn have accommodate them and doesn try much fact that hindus bangladesh are suffering because religious persecution also fact that muslims bangladesh are not suffering due religious persecution first rule anyone illegally coming from bangladesh india must deported but humanitarian causes take precedence and based that hindus should accommodated india know that many hindus their hate for modi are willing forsake hindus bangladesh little more understanding the situation required bangladesh was same india then hindus and muslims bangladesh would equal people are overlooking the fact that hindus and muslims are not equal bangladesh hindus and muslims are equal only india and hence this contradiction use pakistan and bangladesh interchangeably for obvious reason not talking politics here anyone disagrees please debate not get your political agenda here ,1
 bigotry thought you were gone with roch but how missed you how would india india without your daily dose muslim bashing bigotry ,0
 source will have accommodate hindus from bangladesh modi 1403963 html modi have responsibility toward hindus who are harassed and suffer other countries where will they india the only place for them ,-1
apart from tweets couldn find any source him having said this leaving that aside don think any bangladeshi should allowed till sort out our own problems also though things should equal there are few grey areas though there might illegal immigrants from both religions which should strictly discouraged hindu immigrants might also victims ethnic cleansing which case they would and should have higher priority ,1
how anyone going verify the border who muslim and who hindu refugees could from either religion welcoming one set should welcome the other for those wanking over modi saying india the only place for hindus hindus can nepal bhutan any other country asia too india not hindu country secular country ,1
well what surprising what else one expects from bigot like narendra modi ,1
point out the line his speech where mentions bangladeshi muslims all says that bangladeshi hindus should helped the part about muslims was pulled out the tweeter arse ,0
tragedy india the rulers come from italy and the voters from bangladesh jai ,0
both are outsiders poor country and don have the resources support them kolkata victim refugees from bangladesh and suffers from huge influx them that happened during the 70s still get bangladeshis tricking through the border either the political parties here cpm tmc lure them and give them fake voter cards they come india dirt poor and put huge strain relatively poor states like and meghalaya and expected they get involved crime most people absolutely hate bangladeshi refugees and most bengalis ,-1
goldmine for aaptards now these guys will really earn their money ,1
bangladesh exists for muslims that the whole reason they wanted separate from india muslims cannot live bangladesh what its point existing ,1
calm your tits guys the author excuse boy for aap appeasement what the congress does minorities when the aam aadmi party manish sisodia wore cap with common man written urdu nizamuddin auliya dargah the other day the other hand good politics sharma redefining politics 114010301235 html but course going jump every modi line when been declared aap enemy ,1
what supposed tell ,0
dat self righteous smug face lol first bangladeshi hindus are merely refugees but majority bangladeshi muslims are illegal immigrants and second what the most pita about bangladeshi muslims their sectarian and staunch anti national behaviour which causing huge disturbance most region ,1
 think that hindus both bangladesh and pakistan should given shelter india political asylum considering the international norms providing refugee politically abused and threatened people note that modi had said indian muslims are not indians that would not have been acceptable however giving refugee and integrating religious minorities from neighboring countries seems the right thing religious majorities those countries however need use legal modes immigration they wish rather than just cross over the border squat more resources ,1
lekin yeh kahani itihass panno mein kho gaya nothing big just some regular redditors were tricked into sub they got together and engaged vote brigading upvoting pro modi posts and downvoting anti modi posts the sub got reported the admins and they banned the guys who were involved ,0
 2002 every time some guy inserts the comment but what about namoarmy fyi modi was strong with was unbanned the admins ,1
upvote like discussions those involve controversies and love them even more when they are about ,1
 namoarmy fakr hai ,0
 lokpal will clear corruption out india and even greater out indians highly unlikely corruption not crime but disease and remedy development education discipline change attitude laws and rules were enough change country years there would dowry khaps murders untouchability school donations india there would cocaine almost riots gujarat for straight years not because strict law against riots but because shift focus from religions roads and buildings administration and development lokpal aap what ram mandir bjp what poverty congress what reservation mayawati and mulayam,1
aap does not have the numbers get majority best you can hope for that the third fourth front get then they beg for aap support get who would then extract lokpal bill the cost for support ,1
 feel its herd mentality you see media and your friends criticizing and decide aap must bad uncool support anything they well how many have seen speech and read good news about him not many they don even read about and start calling him dramebaz surprised that people who oppose aap are against everything they well think has become ego issue many the people ,1
 the first place aap having real idea solution for any issue besides corruption big hit them the second place they don even have real solution corruption lokpal farce exaggerated dream all does add yet another layer investigative bureaucracy over the acbs cbi intelligence agencies cag vigilance commission and judiciary with them involved investigations will take even more time now but whether corruption will punished different matter and till date have yet hear answer for the very simple point what the lokpal members are themselves corrupt corruption has seeped even into the independent judiciary then why what use independent lokpal that leaves with reason vote for the aap this year beyond being disgusted and wanting spite the other parties which describes the majority their fans ,-1
 much the chaddiwalas out here india and facebook shiver their panties aap does not have the number gain majority and form the government modi going but aap could possibly form the opposition party and that could keep nda its toes ensure does not indulge too much corruption ,1
 you mean say vote for aap pass bill assuming very strong bill and let the country debt the vague notions arvind kejriwal water subsidy kejriwal new all these its like you are making engineering graduate the ceo multi million dollar company its likely going fall and guess what any chance any kejriwal proposed plans not work again going resign the bill can not throw corruption out this country all highly unlikely that even going happen another hand modi will develop the country infrastructure wise may look into matters like improvement rural areas problems electricity and water shortage etc arvind kejriwal just like small kid planning for summer the kid will have huge plans won realize the hurdles ,1
thanks for sharing really needed some hope this morning thank you ,1
 this lie bajarang dal its activists were not involved the riots ,0
lal salaam,0
all looked lovely until read this was organized communist party who are the biggest goondas and murderers seems quite staged now,1
why this being downvoted you might ask both mochi and ansari were critical modi and his development model where development gujarat any talk development just sham still live footpath lal darwaza still single can afford get married because financial status said mochi ansari said modi posing with muslim leaders trying cultivate the impression that the community now with him the truth that the bjp has done nothing for muslims people living other states should know this truth that the reason have come with the book said ansari ,-1
both unmarried but jaya goot more saries,1
 thought had huge power problem and industry was going out because anyways amma came back think 2011 only before that was dmk power there while modi has been office since 2001 against earthquake which destroyed gujarat and redeveloped state from ,1
non political ,0
 don know much modi but far jayalalitha concerned she takes very few inputs from any section most the decisions are taken her within inner circles which imo she could have broader consultation would very good she has stern mind take bold decisions ,1
how this pro amma says has higher revenue much much higher excise revenue but same fiscal deficit the extra money going amma pocket ,1
 not modi fan but think ridiculous compare development metrics two very diverse states very simplistic way look the problem ,-1
not fair comparison amma has hardly been power while modi his 3rd term amma previous track record not good she was voted the worst was worst governed state don remember back when she was power the 90s she seems have big aspirations read and has the potential deliver here hoping she turned over new leaf and doesn fuck things ,-1
this infographic only shows you how developed itself but doesn say anything about what amma herself did this honestly useless you are comparing modi and amma ,-1
seriously did you infographic maker even consider the fact that alcohol tax revenues are significant contributor the treasury top off sells almost all its alcohol from tasmac designated government liquor stores and has rule that only alcohol made can sold imfl this random edit really downvotes this why stopped posting india and even deleted account previously really irritating really says lot about the quality person who lurks here you can post decent rebuttal atleast have the sense refrain from discussion lazy press the button disrespectful the community one gives rat ass about reddiquette damn disappointing guys damn disappointing ,-1
 having less per capita consumption good thing could argue that less consumption due poor connectivity load shedding ,-1
absolute development levels are meaningless development growth rates are what matters you have big head start you are bound ahead absolute terms even your growth near zero learn2math,1
this infographic sucks donkey balls why you compare excise revenue when gujarat dry state and massive lol the power comparison others have said its much better comparison between states terms growth percentage ,1
why only amma significant part development took place under dmk too basically this info graph useless ,-1
there namo amma just nammaamma ,0
 don mind jaya problem she isn the one leading national coalition the chances her ever heading union government are close nil even the third front experiment succeeds against all odds way will mayawati mulayam mamata nitish etc set aside their own egos serve under amma say something about her not really showing the kind vision modi has economy infrastructure industrialization etc but the above will suffice she simply not going make ,1
wasn twain who said lies damned lies and statistics there popular joke which goes wife made millionaire used billionaire information such this gives you idea progress and development what you want see trend set trends truly understand where you are headed this gives you idea whether amma has made life better for her state namo has made life better for his dig deeper there are citations the sources information meaning don know the data trustworthy there explanation the calculation the data either all all very well created and absolutely useless information you really think about but really well sold ,1
well there enough facility get water but how many get water came back from and water problems during drought ,1
 but she doesn have ,0
moditrads will find thing which modi not bad insist that the only thing that important they will also claim that the numbers are all wrong facts you know pseudo secular leftist conspiracy ,1
that ipad screenshot ,0
 why more excise revenue considered positive why less power consumption considered positive why does this study not take into account the fact the anti aphrodisiac effect having pictures such scary woman all over town ,1
don mess with amma ,-1
this the problem with statistics the answers depend the questions asked modi supporters use the statistics modi favour but there entirely different seemingly objective picture available always ,1
didn start off with bigger base development than gujarat plus chennai ,-1
point the way very important less fertility rate and less infant mortality rate both are very important and good example social development ,1
 glad that are finally comparing politicians development rather than other tertiary fish market arguments looking officials data shows that gujrat not doing any better than the other top states none the less gujrat among the top which good think the vibe created that gujrat magnitude times better than other states extrapolation definitely doing better than most states but other states cannot ignored which are doing equally well this infographics gives some incite that ,1
ideally modi should marry amma and they both can pms guess the state that their progeny will rule will the most prosperous the world ,1
 can believe people aren even considering the reason these guys were willing wag their mouths the guy who made this video apparently promised compile their heroic deeds and report higher ups some hindu samaj get them handsomely rewarded now too hard imagine why one would eager reveal one criminal actions before complete strangers can believe the naivete this thread ,1
what our other choice ,-1
the amount muslim haters this sub too damn high ,1
this the reasoning have mind regarding post godhra riots modi did indeed order the genocide and protect the perpetrators did not order the genocide but actively allowed happen and protected the perpetrators did not want happen tried stop but couldn however after the incidents defended the perpetrators did not want happen tried stop the best his ability but couldn actively pursued many convictions possible after the incidents and are brainers there should doubt anyone mind that such person should not become the also not positive because the fact remains that could not stop people from dying with whatever control had but indeed true would give him the benefit the doubt because his track record wrt development since the riots but the unapologetic tone disrespect towards the media aggressive rss support convince that very unlikely that true hence modi not the right person lead the country especially with many other able leaders found even within the bjp edit grammar,1
 not time leave all this think about progress like removing the veils burkhas secularism and move towards first world india leave the evidence courts tell your congress bosses matter what you modi will the india post may 16th 2014 ,1
 you tell lie big enough and keep repeating people will eventually come believe joseph goebells jpg ,0
how can chief minister change judges thought that was the prerogative the chief justice the high court ,1
all things aside people should know ashish khetan the scumbag who worked congress end during cash for votes scam publishing article tehelka implicating bjp the eve discussion ,0
babu bajrangi said the video that modi ensured that all rioters were set free this link here says that several people were convicted that time 2007 this seriously raises questions whether these people are trying accurate exxagerating the power hindu rioters their intrests ,1
this must stickied the nations interest ,0
hearsay compelling evidence ,1
whether modi guilty not watching these people talk this way fucking depressing ,-1
seeing this video super duper depressing indian and hurts the core see someone killing fellow indians basis religion for once was thinking voting bjp because modi but after watching this video not all sorry ,-1
