clean_comment,category
" before used anti rss result anti bjp very skeptical towards aap thought jlp bill was silly drama used lean lot towards left but was not impressed their presence national stage thought other 3rd front parties are over ambitious clowns supported congress they appeared the best available option they are definitely not perfect but better than other options however must admit like most their purported aam admi initiatives you know the which will feed lazy people now still dislike rss vhp their ideology bjp fan boys their rabid bigotry scares don think modi evil too but very skeptical that would able control his masters fans sangha parviar cronies aap not bad very impressed how transparent they have kept their finances for that reason alone wish they will win elections delhi nothing has changed about left other 3rd front but then again you barely hear about them online anyway things seem would still with inc the best available option for the lok sabha
",1
 tried being secular before india after seeing what passed secular india have turned more towards right ,1
 won vote for aap anymore that for sure though this subreddit not the reason for still hate both bjp and congress equally like before this subreddit not very persuasive ,-1
not whole lot has changed except the fact that have lot more conviction beliefs now ,1
 was and still fairly anti congress pro bjp and always denied that bjp supporters were virulent hateful towards muslims reckoned they were just pragmatic but india and twitter etc have convinced that there definitely very hateful strain some the modi bjp support and not sure that something want associate myself with still would support bjp stand most important issues but would like think that not obnoxious and spiteful the average internet hindu ,1
before apathy now antipathy ,0
okay you guys will probably have very hard time believing this but before joined india was slightly disapproving the mns ,-1
was anti congress anti bjp pro communist they good things hometown the space month have morphed have vote congress and may you screw yourself with why scared subbu swamy babu bajrangi and his ilk getting free ride say what they want and what they want after 2014 quite few redditors here support things like collective punishment and rioting long its against the minority and see way stopping that ,1
 have surely changed from being agnostic perhaps slightly anti bjp rss vhp creating this thanks india,1
 political views are constantly evolving based any new information get any new issue understand etc was fed with the congresses looting but know for fact the bjp politicians are better they are all crooks scratching each others backs hoping for aap but they don stand much chance ,1
 hasnt changed all apolitical before simply dont give shit the title related politics only open threads that ask for personal input advice rare cases some opinion ,1
 was neutral cong and pro bjp now hate cong for the corruption there are many things their minority appeasement failure curb anti national elements price rise high handedness towards the people against them think only modi can save ,-1
any specific reason you went with acrylic tubing instead flexible tubing ,0
holy shit may have just jazzed pants ,-1
dropped ram alone dayum ,0
nice build one thing caught eye absolute splurgefest all parts 5900rpm hdd ,1
 that where the canister ooze went ,0
builds 6000 dollar computer uses logitech gaming mouse why not keyboard from them too ,0
its nice and all but your monitors make want beat the shit out you you messing with ocpd here monitors row must the same size and the same orientation with approximately the same bezel the brands can different long remove their decals and clean off the glue just thoughts ,1
holy shit are you literally made money ,-1
yeah well can run counter strike 60fps ,0
thats some build you got there ,0
nice build man pretty damn sexy can ask why titan instead 780ti and why evga motherboard don want rude just curious why ,1
those headphones are schiit couldn resist,0
can wait see the benchmarks ,0
 what the total cost for this battlestation ,0
holy shit what you for living ,-1
want ,0
 came came 17014 jpg ,0
 song you might enjoy same name your awesome build edqh0ofrqrm,1
did you buy those overlord monitors direct form their site ,1
ohhh bit audiophile how that magni modi combo with the fidelio ,0
how you like those overlord monitors considering one you get any burn 120hz they sit for awhile ,0
can ask what you with something this powerful ,1
 don even understand how posts like this can get downvoted ,0
 looks shit now but still proud made ,1
are you using the dac for the speakers too how did you wire the headphones and the speakers ,0
very nice digging the schiit stack ,1
64gb ram 1tb ssd two titans not worthy,-1
did you sleeving for your headphone wires looks awesome ,1
64gb ram you could hold entire game that ,-1
does this build top everything here ,1
gah need this over watercooling dual loops rigid tubing 900d insane hardware what there not like well maybe the cables are bit messy the back were nitpick how are the titans treating you found mine didn really overclock that well well they were okay but not really any better than air heck two them only 480mm xt45 rad and they don break ° please remember post watercooling also love quality build two ,1
what the monitor mount stand for the asus and overlord would love mount mine the same way too seems like total space saver ,1
 what this build for and you play games what games you play ,0
damn that funky ,0
 wish had money ,0
sweet build man ,1
what clocks are you running ,0
how difficult was get the length and bend the tubes perfect ,1
please make your next build chocolate rain,0
but will run crysis ,0
how are the schiit dac and headphone amp looking for nice set for akg ,1
totally diggin ever did liquid system would apparently have spend the money acrylic looks more pleasing than the tubing ,1
question what you for living and what you use primarily with that rig also nice job ,1
 have words describe this dope fuck ,-1
 writing blog about computers and the building process and was wondering could use pic your build one articles yes send you the link thanks and your setup looks fantastic btw ,1
playboynamo,0
 modi has love life the allegation this guy makes him more human ,1
 sharma sometime the year 2008 had got anonymous letter forwarding link the link led obscene clip involving the architect which was shocked and surprised see not realising that phones were bring tapped had spoken about over the phone hold here think have been living under rock can some one tell which clip are they talking about this first time the clip being talked about public ,-1
 they were worried about the woman rights they would never publish the name and that there might have been video her the internet also the msm has conveniently glossed over the part that when these allegations were placed before the court the court came down heavily this person for making wild allegations without any proof ,-1
 cnn ibn she had personal smss her phone from the chief minister sharma that right and frivolous silly smss you cannot imagine absolutely trash and frivolous smss could not believe that could cnn ibn like like like sharma chai piya khakra khaya bhavnagar khatiyaan khaya that kind thing lololololzz sharma clandestine visit something that wrong clandestine visit for overnight stay the residence wrong woohoo wtf juicy ,-1
namo namah also mean namaste hindi like namah sivayah aum namo namah sivayah ,-1
the literal meaning the sanskrit word “namah ः ” “not ” “not ego self”,0
 team gave him clean chit the riots ,1
 dont give shit about 2002 riots want future secure don see that happening under upa ,1
 congresshighcommand leaking ,0
 thhe allegations are true why modi not jail hung already any one can put allegations anyone but the justice decided the court the courts have time and again given him clean chit most there are consppiracy theories opposition propoganda ,1
 cut ,0
,0
 from gujarat have seen the transformation with own eyes give you example when started college ahmedabad 2004 the moment step out from the kalupur railway station eyes used burn due pollution the simple solution that converting petrol autos cng autos modi implemented that policy converting all petrol autos cng autos gave them deadline and incentive and assistance from the govt make that transition the time was 2006 could really see the difference harassment veteran auto wallahs nothing just plain education and assistance which resulted prompt compliance the riverfront wow explanation required guess rurally the roads that connected remote villages have drastically improved and has the journey time and the journey itself have lived entire life gujarat and have seen and felt the transformation also the internet and electricity claims that modi bjp make are true native place remote village northern gujarat and have seen that improvement facilities good metro grandparents place has grand plans and implements them well even the much lauded gujarat tourism true and not hoax have heard several praises from elder tourists from southern india who have opted for the gujarat tourism trips there can many more examples but long story short knows how make the best from the available resources and has definitely changed and improved gujarat ,1
 development also tied the culture that region for example the oil countries like saudi are highly developed good infrastructure facilities good healthcare etc but you will find your freedom restricted you don subscribe the faith the land coming gujarat you are not hindu hindu who loves meat you will find your freedom restricted but you are vegetarian hindu gujarat fab state live there good reason gujarat considered successful hindutva experiment ,1
" here proof that gujarat has flourished under narendra modi htm punjab kerala gujarat among most prosperous equitable states report punjab kerala gujarat among most prosperous equitable states report 371891 pfrom home topstories kapil sibal’ lies punctured point point note response
",1
 tell people from gujarat people who been there what gujarat like just like any other good state india good urban centres and average poor rural areas are there broken roads there yes you people get clean drinking water and other facilities yes and people have access drinking water their premises according planning commission data 2011 clean drinking water treated drinking water like anywhere india completely like the usa terms infrastructure and civic amenities lol there still miles before you even remotely touch that level ,1
 been ahmedabad gandhinagar sometime 2005 and the roads there are high quality and they must the usual counter call this that capital city they take more care roads are automatically renewed etc live hyderabad and proof otherwise also like madhu kishwar wrote her manushi blog people have peaceful and safe social outing even after 10pm etc which relatively unthinkable hyderabad the cops themselves might give people washing and send home ,1
not much they would like you believe but still one the best states india live there are broken roads there still poverty lack clean drinking water issue the people are really friendly and nice fun state and the prohibition alcohol has done wonders the civic life have been gujarat for over years now and have loved every moment except for the fact that isn very accommodating meat lovers come and visit the state sometime the gir national park rann kutch especially during the rannmahotsav daman and diu somnath and many other places visit ,1
 gujarati modiji has done miracle last years have come here witness dnt believe media and leftist propaganda bjp needs seat pls vote for them will make whole india like gujarat,1
 very freshhhh ummm ,1
take look gujarat,0
wot the fok did just say dropped out newcastle primary skool the sickest bloke ull ever meet ive nicked 300 candy bars from tha corner store trained street fitin’ the strongest foker tha entire newcastle gym yer nothin but cheeky lil dickhead hot mum fake bling ill waste and smash fokin bottle oer yer head bruv swer christ think can fokin run gabber whilst sittin yer arse behind lil screen think again wanka callin homeboys rite now preparin for proper rumble tha rumble thatll make nan sore jus hearin about yer waste bruv homeboys all over tha place ill beat proper fokin pulp with fists wanka aint satisfied that ill borrow m8s cricket paddle see that gets the fok out ’ newcastle daft kunt had seen this bloody fokin mess commin might ’ kept gabber from runnin but seems yer stewpid lil twat innit ima shite fury ull drown proper mess knobhead fuck you read ,-1
 aurum mom ,0
 aurum mom ,0
mom,0
yeah dude its completely fab here pic jpg village gujarat more pics the news ece ,1
you will get comments from fanboys and haters neither them will objective search google read few articles compare indicators development with other states and then you will get the full picture ,1
from someone who has been gujarat while travelling various places some years back still remember the clean lane highways windmills everywhere the both sides the roads and the scenic beauty top that development total coherence with nature preservation was just small naive boy then though your dismay and mine those windmills and solar cell arrays are still hold rajasthan iirc the state things hopeless with the increasing thefts inox wind 150 crore the authorities don give fuck except looking for their cut and the private companies say they can install the machinery with these thefts going and its 2013 now compare that with gujarat also someone can confirm have heard from friends that any govt official doesn see your queries complaints within specific period time you can directly approach the modi its that simple try contacting mayawati ,1
yes has used live vastrapur which was considered lower middle class middle class area the vastrapur lake was developed front eyes changing the entire socio economic fabric that place within years also the will second rbecks visited friends village very small blink and you miss place near himmatnagar and the roads were lanes speaking people the village they told because the roads they could get their produce the cities themselves instead hiring 3rd party transporters have stayed many cities over life time delhi mumbai bangalore gujarat and comparing them all over one life time the changes are surprisingly drastic and saying that development happening all over india does not cut majority this development happening urban areas only but gujarat you can see happening both urban and rural areas,1
even germany progressed under hitler rule amidoingitright ,0
the clearly sarcastic and malignant posting this obviously very modest and holier than thou aap supporter ,1
 not all there reason why modi known feku popularly everywhere now doubt has done some good work gujarat but that only from more marketing perspective rather then any good value the people kankariya lake ahemdabad very well known face changed now completely looks like any international location but now common man cant there why because entry fee kankaria lake inr know inr not big deal but once lake which was open public now costing inr just enter highways and roads connecting village best but roads villages and cities are having tons holes industrialization has gone crazy there regulation come from kutch and have seen things really mad there terms pollution there proper guideline implemented terms what should height chimney mills chimney mills are low that when you even walk your home your feet will get black pollution villages are unbearable villages still runs most public transport not petrol diesel but fucking kerosene education definitely improving but you wont see much difference compared years consumption tobacco would highest gujarat gujarat govt corrupt like any other state govt company was bidding for project gujarat were told pay lacs for tender and tender will your favour but still cant give guarantee tomorrow someone else comes with better amount will ditch you your face narmada damn very good example modi doing good work really great work its benefits are tremendous but the way modi portraying progress gujarat just cream but ground reality worst then you can imagine ,1
pure cringe maal ,1
beer mugs err ,0
what time does the counting begin ,0
 hoping that the bjp victory the states assembly elections does not indicate victory for the bjp the national elections ,0
mods users expect this thread receive lot comments you guys want live stream the comments from this thread you can easily going this url this very useful for threads which receive lot comments and updates soccer uses their match threads all the times would have loved contribute but will travelling few hours and will miss most the action ,1
 don count congress out yet they may form government delhi tomorrow will know how much social media impacts elections bjp didn had strong candidate delhi despite aap bjp gets majority will think that only because modi regardless that modi has very tough road ahead congress looses delhi and other states will see very nasty campaign 2014 would love see how muslim majority government employee majority and rich upper middle class area vote share and comparison with 2008 one gets majority who you think aap will support aap will take support from form government ,-1
well the guys below the original active participation politics started with development agenda modi and iac movement regarding this anti corruption middle class etc this aap party not the first india happened earlier during jayaprakash narayan era and his chela mulayam singh was arvind kejriwal that time the second time happened during singh era its simply matter time and enjoy how history repeats ,1
the very fact that the delhi elections are discussed india far more often than the elections the other states indicates that aap having great impact democracy india were not for aap vast majority would not care about these elections the major political parties india have always been cahoots and indian elections have had almost impact the lives most its citizens regardless how many seats aap wins hope all realize that this the first time grassroots organization built volunteers and without any kind corporate backing can have great impact indian elections ,1
 attention please keep mind that the this thread has chosen mark this post with the eddiquette enforced tag therefore any comments that not follow reddiquette will removed please see this page learn more about the tag you see others posting comments that violate this tag please report them the mods thank you for contributing and cooperating bot automoderator comments q11pu what automoderator and this action was performed automatically please contact the moderators this subreddit message compose 2fr 2findia you have any questions concerns ,1
what time does the counting start ,0
goddamn rajdeep and prannoy studios are too busy trying establish brand shivraj ,1
 will consider the option aap approaches for alliance delhi shakeel ahmad secular secular bhai bhai afterall ,0
totaltv aap bjp abp news,0
meanwhile firstpost blog says congress got one from bjp and they are quick edit looks like congress back and aap ,1
hahahahaha all the big faces aap including trailing ,1
just who the fuck harsh vardhan and how winning margin 3000 ,-1
any idea there anyone who will switch from congress bjp during show strength ,0
one other seat going shiromani akali dal which already ally bjp center and another other guy will get ministry for support chances election bjp others edit sad included and coalliation possible jdu and bjp result election ,-1
doesn the government get chance appoint member the anglo indian community few years back when syed sibti was governor this drama was enacted jharkhand ,-1
this the official source for the results htm ,0
shelia loses kejriwaal great win ,1
 can hear sound firecrackers ,1
kejriwal leading 000 votes ,0
shazia ilmi losing htm ,0
varadabhai ndtv trying too well dilute bjp trend bringing out little details fuckthatshit ,-1
 ,0
 hope bjp doesnt seriously consider alliance with aap better elections once more than alliance with this party ,1
deoli seat won aap first mla sheela trailing 500 votes shazia leading ,1
 others get work gandkari ,0
the funny thing most the undeclared seats the difference votes still 1000 800 votes anything can happen ,1
this what anna has say arvind should not take any support for another election need but khichdi anna,0
did not expect this all arvind damn son ,0
congress delhi please and vote delhi pehle aap ,0
 loksatta msg aap hope they join hands soon the beginning the end traditional politics india lok satta party takes pride congratulating the aam aadmi party compelling debut the delhi elections resounding victory for good politics india the first step which was taken earlier the 2009 assembly elections andhra pradesh lok satta the second step now delhi aap bore fruit well before polling day through the unusual choice harsh vardhan the chief ministerial candidate the traditional bjp camp good politics has raised the bar what the acceptable minimum this election the vision for 21st century politics that lok satta has conceived espoused and unwaveringly practiced now some measure showcased aap the delhi elections they crafted their campaign candidates selections and fund raising practices the back the electoral reforms that lok satta pioneered and delivered india the declaration candidate assets tax deductible political donations sanitizing voter rolls etc this first and foremost people victory salute the people delhi for coming out vote masse and providing clear mandate for departure from corruption and nepotism wish aap all the very best transitioning from contesting elections driving good governance delhi lok satta has long been able bat several notches above our league with just one mla the state andhra pradesh and yet drive seminal changes public policy constitutional amendments and bureaucratic reforms these outcomes are reflection lok satta unflinching commitment putting india first and approaching all problem solving with maturity expertise influence negotiation and convergence for the greater good while staunchly refusing paint the other evil with broad brush must never indulge parochial divisive politics pander short populism the cost long term public good the fashioning genuinely modern democracy long and arduous one that takes many teams and many players working concert are joyous see party like aap enter the fray applaud their courage efforts and results and invite many more parties walk with down this path clean politics has taken seed urban india evidenced our own experience hyderabad and the delhi results this will raise the bar politics transform slowly but surely even the traditional dynastic parties into healthy vibrant institutions that reflect the plurality and potential the indian politic and spreads from urban rural india across the next decade has the power reshape india destiny look forward that day jayaprakash narayan,1
latest results baap aap paap ,1
 mom astute political commentary inc others mein categorize karna chahiye ,1
kejriwaal win 22000 votes great victory ,1
 aap getting vote share delhi just behind bjp incredible ,1
 give updates please use this format alliance result leads change total bjp aap cong others awaited click source get the formatting ,0
the aap guy ndtv looks very wise and knowledgeable about his party game and the scenario politics out there quite like reflection who and what sort you get you just make random pick single person from the aap given all the random people all the channels have pulled randomly interview the gathering the aap especially compared how would similar randoms were picked from other parties ,-1
 what likely happen the bjp falls short majority trying buy out the two independents bribe couple congressi ,0
vote share congress bjp nota ,0
bhaskar com shows that bjp has crossed the barrier seats,0
analysts explaining sheila getting defeated kejriwal equals that raj narain defeating indhira gandhi rae barely ,1
bjp aap abp ,0
 the live feed election result news from aam aadmi party website html ,1
looks like bsp doing not bad now,1
bjp attains simple majority delhi but its still leads ,0
purnesh modi city bjp president leading more than 25k votes against congress surat west assembly seat poll ,1
please god let bjp win their own and keep bsp and mayawati out delhi polictics already have enough corruption delhi ,1
the only region from where the cong needs decimated south india sans which already has done once that over would have the dream congressmukthbharat true ,1
 bjp aap loud mouth arnabs channel ,1
lead for aap nareela congress stronghold,0
 for bjp still media discussing there any modi wave ,0
fuck congress love aap and like bjp want congress out every state nice job delhi ,1
bjp aap con bsp ndtv ,0
looks like delhi going fractured bjp leading with trends for extrapolate this around for bjp edit ofcourse its very early and things can swing wildly,1
 ndtv what does the change the right side the chart stand for ,1
newsx showing aap leading bjp ,0
kejriwaal ahead sheila ,0
any good live video coverage being don even know which news channel decent india for this ,1
aap bjp ,0
any idea which websites give the fastest results ,0
whatever the results are delhi hope bjp win the lok sabha with clear majority don want another congress rule center and bjp the only party that can deliver this probably more important reason why are not too much excited about aap win today ,1
