clean_comment,category
just when you think they finally have solid search location another change another place been days like that that completely incredible three full weeks with sign not single piece that plane not blaming everyone just clarify know this has been unprecedented just find hard assimilate that has been this long ,1
 the search area for missing malaysia airlines flight mh370 has been updated after new credible lead was provided the australian maritime safety authority amsa result today’ search will shift area 100 kilometres the north east based updated advice provided the international investigation team malaysia the new search area approximately 319 000 square kilometres and around 850 kilometres west perth more here pdf,1
boys shit going fly this plane isn the indian ocean ,1
cnn confirming email alert the search for flight 370 wreckage has shifted 680 miles the northeast based new credible lead says the australian maritime safety authority ,1
"someone previous thread put new pics the sphere that washed maldives phone can credit but looks like the fire suppression bottle word from 370 but could that linked the search area shift edit thanks conradaiken
",1
"amsa press conference australian maritime safety authority emergency response general manager john young and australian transport safety bureau chief commissioner martin dolan attendance article will include video full press conference for the next half hour aspx full press statements young statement would like update you some credible information amsa has received from the atsb which will see the search area refocused today the amsa search for any sign the missing malaysia airlines flight mh370 has been shifted area north following advice from the australian transport safety bureau international air crash investigation team malaysia provided updated advice the atsb which has examined the information and determined area 1100 kilometres the north east the existing search area now the most credible lead where debris may located the new search area approximately 319 000 square kilometres about 1850 kilometres west perth the australian geospatial intelligence organisation tasking satellites capture images the new area weather conditions are better the revised area and ten aircraft have been tasked for today’ search they include two royal australian air force orions japanese coast guard gulfstream jet japanese orion republic korea orion republic korea c130 hercules royal new zealand air force orion chinese people’ liberation army air force ilyushin united states navy poseidon aircraft and one civil australian jet acting communications relay four the ten aircraft are overhead the search area with further six planes fly over the area today further raaf orion has been placed standby raaf base pearce investigate any reported sightings six ships are relocating the new search area including hmas success and five chinese ships chinese maritime safety administration msa patrol ship haixun the search area hmas success expected arrive the search area late tomorrow night towed pinger locator and bluefin autonomous underwater vehicle have arrived perth assist with location and recovery the black box the depth the water the search area between 2000 and 4000 metres these will fitted australian defence vessel ocean shield which will arrive western australia the coming days dolan the atsb australia’ transport investigation agency working with range other international
expert organisations analyse available data and determine the best area search the key pieces information being analysed relate early positional information from the aircraft and
later polling satellite aircraft system the new information based continuing analysis radar data between the south china sea and the
strait malacca before radar contact was lost indicated the plane was travelling faster than previously estimated resulting increased fuel usage
and reducing the possible distance travelled south into the indian ocean the international investigative team supporting the search continues their analysis which could still
result further refinement the potential flight path this has been combined with information about the likely performance the aircraft—such speed
and fuel consumption for example— arrive the best assessment the area which the aircraft likely have entered the water the information provided the international investigative team the most credible lead currently
have the search aircraft wreckage however this information needs continually adjusted for the length time elapsed since the
aircraft went missing and the likely drift any wreckage floating the ocean surface finally let stress that under international convention malaysia has investigative responsibility for
malaysia airlines flight mh370 this stage the atsb’ main task assist the search for the
aircraft this day the search for the aircraft… have drifted the area for days movement taking into account the actual weather and known currents atsb spokesman unsure what the actual speed was the assumption that the aircraft was travelling somewhat constant speed data from satellite polling and radar matches satellite imagery may may not objects and may not debris fields previous search areas have now been abandoned could debris wind scattered around the world depending who picks – under international convention remains the responsibility the country where the aircraft was registered any wreckage which picked will held for the malaysian investigative teams atsb operating behalf the malaysians any debris picked must handed over australian authorities new area will help get more aircraft scene for longer the other benefit the search area longer the roaring 40s – which means better weather conditions more often debris has been seen the old search areas does not want classify satellite and visual spots those areas debris that just not justifiable with what have seen adds that this kind thing not unusual this the normal business search and rescue operations the new area based refined data possible that further analysis may change that again what are you actually refining the relationship between 777 performance satellite pings and various projections versus that information trying find the right coincidence those and the end point when the aircraft runs out fuel all engines die together there are range scenarios you still believe the course changed several times the best assessment the aircraft headed south consistently into the indian ocean are you looking other leads from the malaysian investigation the two primary methods are the analyses the movement the aircraft that the best information can have satellite imagery being followed but has produced sightings sophisticated oceanographic modelling determine drifts recall please that this days after the event was expected happen over that days there’ significant amount random dispersion objects the search area gets significantly bigger over time data marker buoys are being distributed into new search area continue model drift and keep search area confined all data currently available has been made available the search ",1
here another hammer their quickness abandon the search area based this new data analysis plane speed means they have literally zero confidence any satellite images they have released over the last week does this means satellite imagery just not good enough useful this search all find this hard believe but with this current abandonment all can conclude that there ton floating garbage debris the indian ocean and satellites not able distinguish these pieces well enough this may truly impossible cause folks ,-1
the search area for flight has been updated after new credible lead was provided amsa more info here pdf,1
you know what seems fucked for and mind you this just train thought ordinary person these aircraft find debris drop navigation bouys subsequent aircraft and ships can swoop and pinch yet how many freaking bouys have they dropped and yet how many times have they gone for the search not saying fishy anything just wanted say how awfully difficult find any debris ,-1
and modi going give free farm all ,1
what smart guy lets make him ,1
namo women follow them ,0
 fine cut timber birch apple and oak wedding will include white bread with mayo salami luncheon meat bag shredded cheese and two cases beer bride keeps the change ,1
what kind sorcery this edit you guys just don get the reference ,1
 had said this refrence manmohan singh saying money doesn grow trees modi had said money can grow trees you should have the abilty ,0
why should things myself want the government hand everything silver platter pay for education wedding subsidize food give job and never fire because lazy little shit ,-1
brace yourself the genocide counterpoints are coming ,0
 progressive ,0
why not plant trees anyway irrespective someone born not you can sell the timber and make money use and why why not ,0
 didn know trees got that big after years ,0
definitely deserves this guy ,0
inb4 people saying modi pro dowry ,0
modi encourages deforestation,0
fuck weddings pay for her masters degree abroad ,-1
 way gonna plant and buy myself mercedes well,0
nevermind talking about making your girl independent citizen giving her rights choose and earn still roaming your medieval mentality how one has get their daughter married ,1
reminded this exchange shepard conrad you have some kind weird shrine going very unhappy conrad just poster with few candles very tasteful ,-1
desu ,0
stupid faggot rapedog mods chinacirclejerk superior and encourage shitposting your sub,-1
lol rules against shitposting jerk sub like thats gonna work,1
woah there don insane with pray mean you don want sultana nanamo primal fight you ,-1
bitch you don own what want,1
please tell that item can put house and where get ,0
 don get why you chinkniggerdunecoons make all these rules when you violate them anyway ,0
lol somehow looks like altar put urn @ the middle and you set rofl,1
 jpg,0
the problem with direct linking the fucking bots that publish the real reason for direct linking stealth you all faggots rapists something ,-1
 hey think the same lol ,1
this picture makes want switch maelstrom can build shrine merlwyb when player housing comes out ,0
whoa easy there don wanna like the shrek love shrek life mjbgo7sf0 guy ,1
next patch they release the nanamo namo hair doll ,0
 walked into house the other day find huge portrait the sultana and another her and raubahn the wall facing the door felt like walked into communist state all praise the great leader the odd thing that our allied with maelstrom not immortal flames ,1
 can think nanamo without thinking her grand company speech and the person the audience with the muppet voice cheering hooray nanamo was good speech and that cry ruined made hilarious ,1
that painting quite beautiful ,1
best waifu ,1
 have come the conclusion that lala will never adorable nanamo shrine her the best can achieve ,1
 and divided fall,0
 really happy see the comments here very well explained all the redditors sans few jerks here and there what huge huge difference between aaptards and modi supporters ,1
 right fine with that india got divided the basis religion and non hindus got nation their own why shouldn india cater the need the hindus plight from those countries because are secular fuck that why did the partition happen the basis religions then gandhi fucked over ,1
many countries make distinction between policies for asylum seekers and migrants common sense really ,1
dae think india initiated this kind policy will only increase the incidences persecution minorities pak and bangla imo should done only case case basis discretely and not publicly announced blanket policy ,1
blow modi ,0
 against this very clear how this works support the man doesnt mean that idolise him support his every move blindly means the field leaders that have available believe the best bet lead bring ratan tata the candidate for any party and they will have vote tldr support does not mean worship,1
india for indians only,0
hmm think the whole against illegal immigration and wants illegal immigrants sent back but wherever hindus are the minority and are being persecuted bjp wants them move india seeing india the only hindu majority nation this world tried arguing against this logic pointing out that there are already millions hungry uncared for indians who should looked after first rather than foreign national just because she hindu being persecuted have responsibility neighbor urge bangladesh protect minorities but beyond that against this notion should deport all illegal immigrants irrespective their religion grant them asylum needed case case basis ,-1
 take jab persons migrating legally should welcome all states should accommodate them infiltrators who enter the country illegally need tackled they tend disturb the regional functioning removed religious subtext less controversial interpretation ,1
very good ,1
this allowance refuge the base religion actually valid india was divided india east and west pakistan remember what basis religion bangladesh very much islamist state recognized hindus are seeking refuge due persecution they should allowed however muslims are crossing borders huge numbers than becomes whole new issue which would require diplomatic intervention ,1
old issue rehashed several time here modi wants india give asylum bangladeshi hindu refugees who came here escape persecution and growing islamic radicalism their home country increasingly common problem bangladesh but not bangladeshi illegal migrants general who just came here for economic opportunities because their numbers are simply massive and are causing major demographic changes several indian states ,-1
what wrong with that another lame ass attempt modi bow wow ,-1
 you know what are you comparing refugee status some people anti national scam awarding citizenship status some people think about and let know what you think ,0
 have answered this several times tldr whole heartedly agree persecuted hindus don have any other place earth except probably nepal somebody must help them ,1
 don need more poor people india are already nation with large scale unemployment and poverty why are allowing immigration people with little skills the reason why bjp wants pursue this create voting loyalists for the party congress has allowed unfettered immigration people belonging particular religion just increase its voter base ,-1
same they think this ,0
there are two categories illegal migrants first are those who want come india for economic reasons secondly those who are persecuted should provide asylum those who are persecuted and send back those who came here for economic reasons support modi stand this ,1
modi communalist the little fucker knows bangladeshi hindus are not facing any problems india but has play saviour role which had done gujrat for more than decade pakistani hindus are crossing border rajastan and they are welcomed and are given out ration cards bjp each individual welcomed with celebration ,1
what sickulars say about this live bangladesh for some years bangladesh secular isn ,1
why only bangladesh hindu and christains from pakistan are killed raped and murdered even secularist should accept them plus according these countries are hindustan why not support him ,-1
why does everyone assume those here further votebank agenda politics are only muslim all you are communal,0
here take india was partitioned belief that muslims living india will continue live unharmed similarly hindus living west east pakistans will continue live unharmed india will considered hindu nation where hindus migrating from west east pakistan will welcome take refuge muslims from india are free migrate pakistan now that hindus are not being treated well and they want migrate nation which was created for them they are welcome but muslims have their nation result partition they are not happy with situation there then they should try improve situation rather than move across border not question about hindu muslim question national resources national security and rights indian citizens hindus bangladesh are much minority that you will not notice they migrate india but muslims are migrating much population that has created severe identity crisis east india and pakistan with support china trying take full advantage that situation think beyond your hatered for modi and put india before anything else you will realize are critical situation with major threat from pakistan and china and have handle favor india without giving communal color ,1
this weird ,-1
 the real bhagoda ,1
 have only recently started follow indian politics but this seems absurd ,-1
 didn admit declared that jashodaben his wife wife declares narendra modi his affidavit 923443 html there world difference language always gives you away ,0
why don liberals who yap about the evils hindu society endorse modi right reject child marriage thrust upon him ,1
 hasn experienced one the greatest things the world virgin prime minister that probably first ,1
take that homo gandhi,0
 turn maybe the vicinity turn ,0
left his wife and spies young woman using state machinery the hero deserve ,1
the marriage being child marriage void initio add the fact that they have never lived together and the last time met her was the marriage which was years back see the desperation the anti modi brigade forcing them stoop lowest levels possible ,0
 don care about his personal life but brought this upon himself was not right him deny her existence previous elections and now finally admit before this one the one who publicly claimed has one corrupt for reading indian express article about his wife she came off someone who still admires and respects modi and wished nothing but success for him taking that into consideration its begs the question how modi views women general ,-1
international media will eat this especially when modi becomes the and goes international visits without first lady child marriage exotic india the western media would have field day ,1
 now the former rss pracharak had left the column blank the last four state assembly elections 2001 2002 2007 and 2012 why ,0
the marriage breakdown really irrelevant the issue arguably why modi was not candid about far arguably the answer our extremely judgemental and conservative society ,-1
 used have bunch fliers from the same group believe vietnamese buddhist group based out anaheim california manage dig fliers and can get some contact info forward ,0
that poster awesome love know the source well,1
gautam buddha did something similar too any comments ,0
 had purchased real estate worth lakh the market value which now about crore the man knows how invest ,1
just yesterday there was full page women empowerment modi the man action will not say anything against husband very powerful this job all have survive afraid the consequences jashodaben chimanlal modi ,1
isn the real bhagoda,1
itt bjptards who support section 377 claiming what namo does with his wife personal issue ,0
mutually separated decades back this really news obviously the bankrupt political opponents will milk this for ever but modi grandiosely comesback jashodaben now that will some melodrama ,-1
 considered traitor traitor you vote for modi paki agent you dont damned you and damned you dont ,0
just for the sake argument you telling that people shouldn change their opinions ,0
that was before she became honest and secular ,1
genuine question brother where you think comes from when says muslims hum paanch hamare panchees calls muslims mians edit well was waiting for your response can ask you some more questions not sure you reply again guess will just put them out there said muslims shouldn given relief camps after 2002 riots they turn camps into baby producing factories comment why you think never visited relief camp after 2002 went gaurav yatra pride rally after riots what you think was proud how you feel about maya kodnani being made cabinet minister 2007 when everyone knew her role riots why comment muzzaffarnagar ,1
 can see why namo appeal can see why some muslims would support him too anyway have question for you others you think modi bjp wins clear majority won have depend coalition partners can avoid the influence rss vhp the answer then what the worse that you think can happen india the answer yes then please explain why you think modi would able control bjp mps from around the country well was able control bjp mlas gujarat ,1
such the ummah that breaking the rank will lead much larger repercussion try saying don believe god support gays right live their lives need common personal laws india ,-1
 alright dude they will see the light soon enough ,1
vote for india,0
choosing mind over heart mark win over fear congrats,1
you shouldnt stalk tweets stalk her pics,0
 aaptards have visited this post ,0
people change opinions they learn more ,1
congrats friend that took guts,0
kudos considering the prevailing mood brave thing even you and find perfectly logical ,1
found the flier the flier says hoang long phong free distribution 408 960 4903 california usa monk with lot youtube clips vietnamese the flier the same writing style the poster with some the same pictures probably just call and ask about the poster ,1
christmas eve prep last year girl went the asian market for groceries and the way out were the recipients teaching one these pure land monks who was traveling around america preaching dharma was interesting experience because was the most evangelical ever seen buddhism expounded anyway heaped materials and have this exact poster you promise give good home will mail you tube and figure things out ,1
dude you are looking for perfect party with best policies and 100 honest candidates then think you are about 2000 years too late may not perfect but seems like bjp your only choice lesser evils amongst the others ,1
 • they had sushma swaraj arun jaitley candidate they would have had vote minute really sushma over namo ,1
 find funny that the only party that stands for unified civil code classified being socially conservative and regressive sigh ,1
ermm did you notice that both are different accounts ,0
since did not mention karnataka acknowledges the fact that they fucked taka hmm nice,0
both statements are true though may not look nice next each other ,1
come tards let put aside those differences and upvote good joke shall ,1
well right and yeah that bot annoying ,-1
read somewhere that pornnath bharti was abusing modi maa behen thats when people tried beat him ,0
 guess slaps weren getting them enough funds ,0
this all just ploy give upa thank god most the polling done nda bust this time,1
just before 24th april ,0
 convenient isn shazia clip comes out aap struggling explain that and immediately some bjp supporters beat spamnath bharti divert the attention ,0
 video queogkighsa ,0
welcome namocracy there are people twitter who actually believe this either staged deserved sigh calling now modi rajnath will issue statement saying condemns the attack soon and everything will forgotten firs investigation nothing ,1
itt bjp supporters instead sympathizing are making fun somnath whatever happened shameful ideological differences may exist but resorting violence not justified ,1
this sub polarized fuck ,-1
can people come out their fucking fap modi matter what world for once and just condemn this outright this the most disgusting level modi fappers have stooped ,-1
aap people always get attacked one day before polls bhk,0
now that the elections are supposedly the bag the real face and instincts bjp comes surface ,1
wow they have improved from staging slaps now staging getting beat ,1
 few things made clear these elections there are tards and cunts everywhere india one can stand criticism their opinion you voice your opinion and doesn match mine then you are either tard cunt and not patriot those with the best intentions get corrupted and the corrupt can have the best intentions all screwed and the elections are really about who gets have our asses first,1
what crazy downvoting libtards here this isn the first time aap has tried pull off publicity stunts like this ,-1
sab parties chutiye hain gaand maro dusre ,0
feels good that was somnath beaten ,1
like said before ,0
nationalist bahut nationalist,0
again drama all staged ,0
nautanki timed best ,1
nda last government did corruption acquiring coffins for soldiers during war such nationalism such hinduism wow god knows what they are going now ,1
har har modi gar gar modi ,0
this just trailer what will happen all the dissenters and opposition members once modi becomes the and somnath bharti lucky have escaped with just beating wasn shot like haren pandya encountered like ishrat jahan killed riot countless least not yet like indra gandhi this person very bad news for common civil liberties unlike mrs gandhi though doesn even have the saving grace secularism ,-1
such same shame the perpetrators and shame those defending such act ,0
everytime aap has some public fallout shazia communal comments lack funds someone from aap gets beaten very interesting ,1
 main jaa raha hun indiansgonewild par wahan par kuch naya material post hua ,1
lol how ironic this still not bad what this fat spammer did those ugandan women ,1
pretty ridiculous how ibnlive are blaming bjp for this without any proof investigation someone said they were wearing bjp topis lol like they would wear aap congress topis before doing this ,1
kejriwal slaps are out fashion now ,0
 get aap volunteers wear some bjp caps and slap put black paint eggs kejriwal bharti profit from trp donations ,-1
